{
  "schema_version": 2,
  "upload_id": "019d9c40-7b3c-7000-8000-000000003003",
  "runs": [],
  "events": [{
    "event_id": "019d9c40-7b3c-7000-8000-000000003004",
    "run_id": "019d9c40-7b3c-7000-8000-000000003002",
    "sequence": 1,
    "kind": "authorization",
    "step_name": "Authorization",
    "partition_name": null,
    "status": "success",
    "started_at_ms": 1787500000000,
    "ended_at_ms": 1787500000100,
    "duration_ms": 100,
    "command": null,
    "exit_code": null,
    "stdout_chunks": 1,
    "stderr_chunks": 0,
    "verification": "Bearer authentication accepted",
    "device_state": "authorized",
    "retry_safe": null,
    "remedies": [],
    "error_class": null,
    "error_code": null,
    "error_message": null,
    "credential_redactions": []
  }],
  "output_chunks": []
}
