{
  "schema_version": 2,
  "upload_id": "019d9c40-7b3c-7000-8000-000000000001",
  "runs": [{
    "run_id": "019d9c40-7b3c-7000-8000-000000000002",
    "operation_kind": "fastboot_flash",
    "title": "VIVO line flash",
    "outcome": "success",
    "device_serial": "9A7F23BC10D4",
    "source_paths": ["C:\\Users\\Public\\Nwflash\\boot.img"],
    "source_urls": [],
    "client_version": "1.4.0",
    "started_at_ms": 1787500000000,
    "ended_at_ms": 1787500002500,
    "duration_ms": 2500,
    "error_class": null,
    "error_code": null,
    "error_message": null,
    "final_sequence": 3,
    "trace_complete": true,
    "trace_loss_reason": null
  }],
  "events": [{
    "event_id": "019d9c40-7b3c-7000-8000-000000000003",
    "run_id": "019d9c40-7b3c-7000-8000-000000000002",
    "sequence": 1,
    "kind": "authorization",
    "step_name": "Authorization",
    "partition_name": null,
    "status": "success",
    "started_at_ms": 1787500000000,
    "ended_at_ms": 1787500000100,
    "duration_ms": 100,
    "command": null,
    "exit_code": null,
    "stdout_chunks": 0,
    "stderr_chunks": 0,
    "verification": "Bearer authentication accepted",
    "device_state": "authorized",
    "retry_safe": null,
    "remedies": [],
    "error_class": null,
    "error_code": null,
    "error_message": null,
    "credential_redactions": []
  }, {
    "event_id": "019d9c40-7b3c-7000-8000-000000000004",
    "run_id": "019d9c40-7b3c-7000-8000-000000000002",
    "sequence": 2,
    "kind": "command",
    "step_name": "Flash boot_a",
    "partition_name": "boot_a",
    "status": "success",
    "started_at_ms": 1787500000100,
    "ended_at_ms": 1787500002400,
    "duration_ms": 2300,
    "command": {
      "program": "C:\\Nwflash\\platform-tools\\fastboot.exe",
      "argv": ["flash", "boot_a", "C:\\Users\\Public\\Nwflash\\boot.img"],
      "display_command": "fastboot flash boot_a C:\\Users\\Public\\Nwflash\\boot.img",
      "working_directory": "C:\\Nwflash\\platform-tools",
      "paths": ["C:\\Users\\Public\\Nwflash\\boot.img"],
      "urls": [],
      "serial": "9A7F23BC10D4"
    },
    "exit_code": 0,
    "stdout_chunks": 1,
    "stderr_chunks": 1,
    "verification": "fastboot completed and the boot_a partition event persisted",
    "device_state": "fastboot",
    "retry_safe": null,
    "remedies": [],
    "error_class": null,
    "error_code": null,
    "error_message": null,
    "credential_redactions": []
  }, {
    "event_id": "019d9c40-7b3c-7000-8000-000000000005",
    "run_id": "019d9c40-7b3c-7000-8000-000000000002",
    "sequence": 3,
    "kind": "terminal",
    "step_name": "Operation complete",
    "partition_name": null,
    "status": "success",
    "started_at_ms": 1787500002400,
    "ended_at_ms": 1787500002500,
    "duration_ms": 100,
    "command": null,
    "exit_code": null,
    "stdout_chunks": 0,
    "stderr_chunks": 0,
    "verification": "Operation completed with persisted success evidence",
    "device_state": "complete",
    "retry_safe": null,
    "remedies": [],
    "error_class": null,
    "error_code": null,
    "error_message": null,
    "credential_redactions": []
  }],
  "output_chunks": [{
    "chunk_id": "019d9c40-7b3c-7000-8000-000000000006",
    "event_id": "019d9c40-7b3c-7000-8000-000000000004",
    "stream": "stdout",
    "chunk_index": 0,
    "text": "Sending boot_a\nOKAY\n",
    "byte_count": 20,
    "sha256": "71977b278c69313b52f81c96e75d91ce5df771ffc3d24e4d24ef8c0c8cae4b6f"
  }, {
    "chunk_id": "019d9c40-7b3c-7000-8000-000000000007",
    "event_id": "019d9c40-7b3c-7000-8000-000000000004",
    "stream": "stderr",
    "chunk_index": 0,
    "text": "",
    "byte_count": 0,
    "sha256": "e3b0c44298fc1c149afbf4c8996fb92427ae41e4649b934ca495991b7852b855"
  }]
}
